{
  "$schema": "https://json-schema.org/draft/2020-12/schema",
  "$id": "handoff-v1.2",
  "title": "Handoff Document v1.2",
  "description": "Structured handoff emitted by an agent at the end of any task (handoff-first; an HTML report artifact is optional). Validates the handoff contract between pipeline stages.",
  "type": "object",
  "required": ["schema_version", "self_pull", "agent", "context", "produced_at", "artifact", "scope", "metrics"],
  "additionalProperties": false,
  "properties": {
    "schema_version": {
      "type": "string",
      "enum": ["handoff-v1.2"],
      "description": "Schema version identifier: 'handoff-v1.2', the only version (v1/v1.1 retired in 0.5.0; re-emit an old handoff as v1.2 with self_pull)."
    },
    "self_pull": {
      "type": "object",
      "required": ["refs"],
      "additionalProperties": false,
      "description": "Layer-1 self-pull audit line, always required. Records the memory atoms the emitting session actually read, in InjectedContext ref style (context-relative, specs/-prefixed).",
      "properties": {
        "refs": {
          "type": "array",
          "minItems": 1,
          "items": {
            "type": "string",
            "pattern": "^(?!/)(?!.*(?:^|/)\\.\\.(?:/|$))[a-zA-Z0-9_./-]+$",
            "description": "Context-relative, specs/-prefixed atom ref (e.g. specs/memory/ARCHITECTURE.md). No absolute paths, no .. traversal."
          },
          "description": "Non-empty list of self-pulled atom refs. Never list an atom that was not read."
        }
      }
    },
    "agent": {
      "type": "string",
      "description": "Name of the agent that produced this handoff (e.g. 'dd-sw-engineer-sr')."
    },
    "context": {
      "type": "string",
      "description": "Active dadaia context name (e.g. 'dadaia-workspace')."
    },
    "produced_at": {
      "type": "string",
      "format": "date-time",
      "pattern": "^\\d{4}-\\d{2}-\\d{2}T\\d{2}:\\d{2}:\\d{2}(\\.\\d+)?(Z|[+-]\\d{2}:\\d{2})$",
      "description": "ISO 8601 UTC timestamp when the handoff was produced."
    },
    "scope": {
      "type": "string",
      "description": "Scope descriptor for the handoff (e.g. file path, module, component)."
    },
    "reviewed_sha": {
      "type": "string",
      "pattern": "^[0-9a-f]{40}$",
      "description": "The commit a verdict judged; written only by the emitter's verdict.py."
    },
    "diff_sha256": {
      "type": "string",
      "pattern": "^[0-9a-f]{64}$",
      "description": "The hash of the diff a verdict judged, from worktree.py hash; written only by verdict.py."
    },
    "metrics": {
      "type": "object",
      "description": "Key quantitative metrics for this handoff (e.g. token counts, file counts).",
      "additionalProperties": true
    },
    "artifact": {
      "type": "object",
      "required": ["type"],
      "additionalProperties": false,
      "properties": {
        "type": {
          "type": "string",
          "enum": ["report", "spec", "plan", "tasks", "closure", "memory", "other"],
          "description": "Type of the artifact produced."
        },
        "path": {
          "type": "string",
          "pattern": "^(?!/)(?!.*(?:^|/)\\.\\.(?:/|$))[a-zA-Z0-9_./{}-]+$",
          "description": "Relative path from workspace root to the artifact file. Supports {context} and {run_ts} templates. Omitted in v1.1 handoff-first (no-report) emission; when present, content_hash must accompany it."
        },
        "content_hash": {
          "type": "string",
          "pattern": "^[a-f0-9]{64}$",
          "description": "SHA-256 hex digest of the artifact file content. Required whenever path is present — the CLI's `reports validate` verb recomputes the file hash and fails on mismatch or absence."
        }
      }
    },
    "release_id": {
      "type": "string",
      "description": "Optional release identifier (e.g. 'agent-comms-v1')."
    },
    "findings": {
      "type": "array",
      "items": {
        "type": "object",
        "required": ["severity", "message", "detail_md", "fix_recommendation"],
        "additionalProperties": false,
        "properties": {
          "severity": {
            "type": "string",
            "enum": ["CRITICAL", "HIGH", "MEDIUM", "LOW", "INFO"],
            "description": "Severity level of the finding."
          },
          "message": {
            "type": "string",
            "description": "Human-readable description of the finding."
          },
          "detail_md": {
            "type": "string",
            "description": "Extended markdown detail on the finding."
          },
          "fix_recommendation": {
            "type": "string",
            "description": "Concrete fix recommendation for this finding."
          }
        }
      },
      "description": "Optional list of key findings from the agent's work."
    },
    "decisions_required": {
      "type": "array",
      "items": {
        "type": "string"
      },
      "description": "Optional list of decisions or open questions the next agent or operator must resolve."
    },
    "next_handoff": {
      "type": "object",
      "required": ["agent", "context", "expected_artifact_type"],
      "additionalProperties": false,
      "properties": {
        "agent": {
          "type": "string",
          "description": "Name of the next agent in the pipeline."
        },
        "context": {
          "type": "string",
          "description": "Context for the next handoff."
        },
        "expected_artifact_type": {
          "type": "string",
          "enum": ["report", "spec", "plan", "tasks", "closure", "memory", "other"],
          "description": "Expected artifact type from the next agent."
        }
      },
      "description": "Optional pointer to the expected next handoff in the pipeline."
    },
    "verdict": {
      "type": "string",
      "enum": ["APPROVED", "REJECTED"],
      "description": "Optional approval verdict emitted by dd-code-reviewer. When present, must be APPROVED or REJECTED. Read by `worktree.py merge` (worktrees/AGENTS.md §2)."
    },
    "verdict_reason": {
      "type": "string",
      "description": "Optional human-readable summary explaining the verdict."
    }
  }
}
